{
  "schema_version": "crexx.import-resolution-report/v1",
  "status": "observed",
  "tool": {
    "name": "rxc",
    "version": "crexx-1.0.0-beta.3+local.gbb0d211a8d17.dirty"
  },
  "primary_source": "@primary-source/0/levelg_source_consumer.crexx",
  "options": {
    "source_roots": ["@primary-source/0", "@source/0"],
    "binary_roots": [],
    "auto_import_rxas": false,
    "executable_directory": "excluded"
  },
  "candidate_events": [
    {
      "sequence": 0,
      "stage": "source",
      "module": "levelg",
      "candidate": {
        "path": "@primary-source/0/levelg.crexx",
        "kind": "source",
        "root_kind": "primary-source",
        "root_index": 0,
        "sha256": "08eb3d9eba9af2dfd318a5333c4d8b2a9f7a2b597d8e299ac570c91a70dfe51d",
        "digest_status": "available",
        "mtime_seconds": 1791716550
      },
      "decision": "admitted",
      "reason": "first-candidate-for-stage"
    },
    {
      "sequence": 1,
      "stage": "source",
      "module": "levelb_rxas_consumer",
      "candidate": {
        "path": "@primary-source/0/levelb_rxas_consumer.crexx",
        "kind": "source",
        "root_kind": "primary-source",
        "root_index": 0,
        "sha256": "e33b4a1ee75a63207ac622ebd7aab067f9145ddc562dc8d0a70d922584850987",
        "digest_status": "available",
        "mtime_seconds": 1791716548
      },
      "decision": "admitted",
      "reason": "first-candidate-for-stage"
    },
    {
      "sequence": 2,
      "stage": "source",
      "module": "levelg_rxas_consumer",
      "candidate": {
        "path": "@primary-source/0/levelg_rxas_consumer.crexx",
        "kind": "source",
        "root_kind": "primary-source",
        "root_index": 0,
        "sha256": "a8711a8d3edc4a42534f3100ffa90b73ff96e89bc6babe0ceb138970385ed99f",
        "digest_status": "available",
        "mtime_seconds": 1791707220
      },
      "decision": "admitted",
      "reason": "first-candidate-for-stage"
    },
    {
      "sequence": 3,
      "stage": "source",
      "module": "levelb",
      "candidate": {
        "path": "@primary-source/0/levelb.crexx",
        "kind": "source",
        "root_kind": "primary-source",
        "root_index": 0,
        "sha256": "feef09ca8627a36a91be781fff0e790316451408d5dfac9a3d1a7d3211f58a6c",
        "digest_status": "available",
        "mtime_seconds": 1791716546
      },
      "decision": "admitted",
      "reason": "first-candidate-for-stage"
    },
    {
      "sequence": 4,
      "stage": "source",
      "module": "levelb_rxbin_consumer",
      "candidate": {
        "path": "@primary-source/0/levelb_rxbin_consumer.crexx",
        "kind": "source",
        "root_kind": "primary-source",
        "root_index": 0,
        "sha256": "e33b4a1ee75a63207ac622ebd7aab067f9145ddc562dc8d0a70d922584850987",
        "digest_status": "available",
        "mtime_seconds": 1791716549
      },
      "decision": "admitted",
      "reason": "first-candidate-for-stage"
    },
    {
      "sequence": 5,
      "stage": "source",
      "module": "levelg_rxbin_consumer",
      "candidate": {
        "path": "@primary-source/0/levelg_rxbin_consumer.crexx",
        "kind": "source",
        "root_kind": "primary-source",
        "root_index": 0,
        "sha256": "a8711a8d3edc4a42534f3100ffa90b73ff96e89bc6babe0ceb138970385ed99f",
        "digest_status": "available",
        "mtime_seconds": 1791707221
      },
      "decision": "admitted",
      "reason": "first-candidate-for-stage"
    },
    {
      "sequence": 6,
      "stage": "source",
      "module": "levelb_source_consumer",
      "candidate": {
        "path": "@primary-source/0/levelb_source_consumer.crexx",
        "kind": "source",
        "root_kind": "primary-source",
        "root_index": 0,
        "sha256": "e33b4a1ee75a63207ac622ebd7aab067f9145ddc562dc8d0a70d922584850987",
        "digest_status": "available",
        "mtime_seconds": 1791716547
      },
      "decision": "admitted",
      "reason": "first-candidate-for-stage"
    },
    {
      "sequence": 7,
      "stage": "source",
      "module": "float_fold_provider",
      "candidate": {
        "path": "@source/0/float_fold_provider.crexx",
        "kind": "source",
        "root_kind": "source",
        "root_index": 0,
        "sha256": "c5fb02f67b7549e8a90f347643c4f7be263a0d663915fe4b95aaa78b7dfe0ac8",
        "digest_status": "available",
        "mtime_seconds": 1791716551
      },
      "decision": "admitted",
      "reason": "first-candidate-for-stage"
    }
  ],
  "selected_candidates": [
    {
      "stage": "source",
      "module": "levelg",
      "candidate": {
        "path": "@primary-source/0/levelg.crexx",
        "kind": "source",
        "root_kind": "primary-source",
        "root_index": 0,
        "sha256": "08eb3d9eba9af2dfd318a5333c4d8b2a9f7a2b597d8e299ac570c91a70dfe51d",
        "digest_status": "available",
        "mtime_seconds": 1791716550
      }
    },
    {
      "stage": "source",
      "module": "levelb_rxas_consumer",
      "candidate": {
        "path": "@primary-source/0/levelb_rxas_consumer.crexx",
        "kind": "source",
        "root_kind": "primary-source",
        "root_index": 0,
        "sha256": "e33b4a1ee75a63207ac622ebd7aab067f9145ddc562dc8d0a70d922584850987",
        "digest_status": "available",
        "mtime_seconds": 1791716548
      }
    },
    {
      "stage": "source",
      "module": "levelg_rxas_consumer",
      "candidate": {
        "path": "@primary-source/0/levelg_rxas_consumer.crexx",
        "kind": "source",
        "root_kind": "primary-source",
        "root_index": 0,
        "sha256": "a8711a8d3edc4a42534f3100ffa90b73ff96e89bc6babe0ceb138970385ed99f",
        "digest_status": "available",
        "mtime_seconds": 1791707220
      }
    },
    {
      "stage": "source",
      "module": "levelb",
      "candidate": {
        "path": "@primary-source/0/levelb.crexx",
        "kind": "source",
        "root_kind": "primary-source",
        "root_index": 0,
        "sha256": "feef09ca8627a36a91be781fff0e790316451408d5dfac9a3d1a7d3211f58a6c",
        "digest_status": "available",
        "mtime_seconds": 1791716546
      }
    },
    {
      "stage": "source",
      "module": "levelb_rxbin_consumer",
      "candidate": {
        "path": "@primary-source/0/levelb_rxbin_consumer.crexx",
        "kind": "source",
        "root_kind": "primary-source",
        "root_index": 0,
        "sha256": "e33b4a1ee75a63207ac622ebd7aab067f9145ddc562dc8d0a70d922584850987",
        "digest_status": "available",
        "mtime_seconds": 1791716549
      }
    },
    {
      "stage": "source",
      "module": "levelg_rxbin_consumer",
      "candidate": {
        "path": "@primary-source/0/levelg_rxbin_consumer.crexx",
        "kind": "source",
        "root_kind": "primary-source",
        "root_index": 0,
        "sha256": "a8711a8d3edc4a42534f3100ffa90b73ff96e89bc6babe0ceb138970385ed99f",
        "digest_status": "available",
        "mtime_seconds": 1791707221
      }
    },
    {
      "stage": "source",
      "module": "levelb_source_consumer",
      "candidate": {
        "path": "@primary-source/0/levelb_source_consumer.crexx",
        "kind": "source",
        "root_kind": "primary-source",
        "root_index": 0,
        "sha256": "e33b4a1ee75a63207ac622ebd7aab067f9145ddc562dc8d0a70d922584850987",
        "digest_status": "available",
        "mtime_seconds": 1791716547
      }
    },
    {
      "stage": "source",
      "module": "float_fold_provider",
      "candidate": {
        "path": "@source/0/float_fold_provider.crexx",
        "kind": "source",
        "root_kind": "source",
        "root_index": 0,
        "sha256": "c5fb02f67b7549e8a90f347643c4f7be263a0d663915fe4b95aaa78b7dfe0ac8",
        "digest_status": "available",
        "mtime_seconds": 1791716551
      }
    }
  ],
  "provider_bindings": []
}
